{
  "packageId": "gate2a-p-source-statement-records",
  "contractVersion": "0.13.0-draft",
  "sourcePolicyPath": "auditors/problem-evidence/eval-policy/phase1-benchmark-policy.json",
  "sourcePolicySchemaVersion": "1.0.0",
  "statementDigestAlgorithm": "json.dumps-sort-keys-compact-sha256",
  "scope": "pilot-subset",
  "records": [
    {
      "sourceStatementId": "SS-006",
      "v15Index": 6,
      "fixture": "contradictory-evidence.json",
      "requirementId": "REQ-2",
      "statementType": "requiredVerificationBehavior",
      "statementText": "First validate EV-004's provenance, complete active-assembly measurement boundaries, segment fit, threshold, and supersession status; if it remains credible, it establishes instance-scoped existence.",
      "statementDigest": "99c4041fe85e7c11029a8cf9193e910b969f010fee67ba23ef1c32739903b8da",
      "statementClassification": "composite",
      "decompositionStatus": "fully_decomposed",
      "pilotSelectionRationale": "Decomposition into many independently testable obligations; declared ordering; human credibility residue.",
      "decompositionAssurance": "unconfirmed-pending-owner-review",
      "unrepresentedObligations": []
    },
    {
      "sourceStatementId": "SS-026",
      "v15Index": 26,
      "fixture": "contradictory-evidence.json",
      "requirementId": "REQ-5",
      "statementType": "prohibitedSubstitution",
      "statementText": "Do not substitute willingness to pay for the proposed product.",
      "statementDigest": "1e78ab7b0d9792295ee86f57af8c834c657e7976bcb589c65fa8e27f82aba2d0",
      "statementClassification": "deterministic",
      "decompositionStatus": "fully_decomposed",
      "pilotSelectionRationale": "Cleanest deterministic prohibition; single obligation part.",
      "decompositionAssurance": "unconfirmed-pending-owner-review",
      "unrepresentedObligations": []
    },
    {
      "sourceStatementId": "SS-033",
      "v15Index": 33,
      "fixture": "missing-evidence.json",
      "requirementId": "REQ-1",
      "statementType": "prohibitedSubstitution",
      "statementText": "Do not treat adjectives like small or struggling as decidable boundaries.",
      "statementDigest": "63b192d5d78350c7165a39a81e91264ef287ad5cba4cb2767e93e97ad94b0e32",
      "statementClassification": "model-assisted",
      "decompositionStatus": "fully_decomposed",
      "pilotSelectionRationale": "Model-assisted extraction followed by a deterministic check over the extracted structure.",
      "decompositionAssurance": "unconfirmed-pending-owner-review",
      "unrepresentedObligations": []
    },
    {
      "sourceStatementId": "SS-034",
      "v15Index": 34,
      "fixture": "missing-evidence.json",
      "requirementId": "REQ-2",
      "statementType": "requiredVerificationBehavior",
      "statementText": "Require a duration threshold the team can be wrong about.",
      "statementDigest": "3c5f31e65ffeb32121cca784d7180fd8257b9c6244ec7d6d10f77667abf039a7",
      "statementClassification": "unresolved",
      "decompositionStatus": "fully_decomposed",
      "pilotSelectionRationale": "Unresolved statement that still yields one independently testable obligation part.",
      "decompositionAssurance": "unconfirmed-pending-owner-review",
      "unrepresentedObligations": []
    },
    {
      "sourceStatementId": "SS-055",
      "v15Index": 55,
      "fixture": "missing-evidence.json",
      "requirementId": "REQ-5",
      "statementType": "requiredVerificationBehavior",
      "statementText": "Pass requires the configured minimum of independent in-segment sources documenting qualifying money or staff-hour commitment to the existing problem. Counterevidence requires documented evaluation followed by decline or abandonment because the problem did not justify expenditure; non-purchase, missing records, unrelated budget constraints, and rejection of the proposed product do not qualify. Fail requires the configured counterevidence-source minimum and no comparably credible qualifying commitment within this packet; credible evidence on both sides yields partial.",
      "statementDigest": "07582e4607806a3aab3a25c92fe4afcd596c5c7cd1bf8644b6fe28992f800701",
      "statementClassification": "composite",
      "decompositionStatus": "fully_decomposed",
      "pilotSelectionRationale": "Longest composite obligation; four-way status rule with model-assisted and human residues.",
      "decompositionAssurance": "unconfirmed-pending-owner-review",
      "unrepresentedObligations": []
    },
    {
      "sourceStatementId": "SS-060",
      "v15Index": 60,
      "fixture": "strong-evidence.json",
      "requirementId": "REQ-1",
      "statementType": "requiredVerificationBehavior",
      "statementText": "Treat any material classification disagreement with team sorting as evidence of an underspecified boundary that changes the result from pass to partial.",
      "statementDigest": "99e81b65df04c7eab35410df3503dcf388bbe716340a1fdf81d8ed48ff2b1ace",
      "statementClassification": "composite",
      "decompositionStatus": "fully_decomposed",
      "pilotSelectionRationale": "Human-required materiality judgment isolated from an executable status transition.",
      "decompositionAssurance": "unconfirmed-pending-owner-review",
      "unrepresentedObligations": []
    },
    {
      "sourceStatementId": "SS-070",
      "v15Index": 70,
      "fixture": "strong-evidence.json",
      "requirementId": "REQ-3",
      "statementType": "requiredVerificationBehavior",
      "statementText": "Define eight consecutive calendar-week windows before inspecting events.",
      "statementDigest": "01fd9be3292cd00b44d2769a8a1cbc67bc6f47d895edcc9a324de07d2f129e70",
      "statementClassification": "composite",
      "decompositionStatus": "fully_decomposed",
      "pilotSelectionRationale": "Ordering semantics: declared ordering is testable, observed chronology is unsupported.",
      "decompositionAssurance": "unconfirmed-pending-owner-review",
      "unrepresentedObligations": []
    }
  ]
}
